{
  "artifact_type": "congruent_shape_surface_projection",
  "as_of": "2026-08-01",
  "entries": [
    {
      "control_question": "Can a candidate be replayed from the same frozen base and accepted without trusting the worker that produced it?",
      "current_surface_refs": [
        "repo://src/ahead_rev_sim/frontier_exec.py",
        "repo://src/ahead_rev_sim/execution_proof.py",
        "repo://src/ahead_rev_sim/consist_execution.py"
      ],
      "implemented_invariants": [
        "accepted output is separate from execution completion",
        "candidate state and restoration proofs are sealed",
        "first divergence is preserved"
      ],
      "implementation_state": "contract_implemented",
      "next_design_transaction": "Package the full physical transaction for artifact-only replay by an external acceptor without repository access.",
      "open_invariants": [
        "artifact-only external replay across a measured physical run"
      ],
      "pylon_id": "bounded-transition-spine"
    },
    {
      "control_question": "Can a provider be removed without changing workload identity, acceptance, fallback, publication, or historical custody?",
      "current_surface_refs": [
        "repo://src/ahead_rev_sim/provider_hitch.py",
        "repo://src/ahead_rev_sim/commodity_registry.py",
        "repo://schemas/physical-compute-provider-hitch.schema.json"
      ],
      "implemented_invariants": [
        "provider manifests cannot claim architectural authority",
        "offers and acknowledged submissions are separate states",
        "dependency mode is commodity_only"
      ],
      "implementation_state": "contract_implemented",
      "next_design_transaction": "Ingest the first acknowledged external host or cartridge submission and replace one reference endpoint without changing acceptance.",
      "open_invariants": [
        "acknowledged external provider substitution"
      ],
      "pylon_id": "authority-outside-provider"
    },
    {
      "control_question": "Does every ambiguous, missing, refused, faulted, unmeasured, and accepted condition retain a distinct terminal receipt?",
      "current_surface_refs": [
        "repo://src/ahead_rev_sim/physical_runtime.py",
        "repo://src/ahead_rev_sim/provider_hitch.py",
        "repo://src/ahead_rev_sim/evp.py"
      ],
      "implemented_invariants": [
        "MMIO ambiguity refuses closed",
        "provider and EVP blockers are explicit",
        "physical claims remain false when evidence is absent"
      ],
      "implementation_state": "contract_implemented",
      "next_design_transaction": "Exercise facility denial, fabrication failure, instrument dropout, and physical drift as distinct negative-space fixtures.",
      "open_invariants": [
        "institutional and physical failure fixtures beyond software refusal"
      ],
      "pylon_id": "negative-space-refusal-ledger"
    },
    {
      "control_question": "Can source, build, execution, measurement, acceptance, and supersession be reconstructed after the original actor disappears?",
      "current_surface_refs": [
        "repo://src/ahead_rev_sim/commodity_registry.py",
        "repo://src/ahead_rev_sim/riscv_target.py",
        "repo://src/ahead_rev_sim/consist_execution.py",
        "repo://src/ahead_rev_sim/congruent_shapes.py"
      ],
      "implemented_invariants": [
        "registry, workload, target, consist, EVP, and pylon artifacts are SHA-256 sealed",
        "source and public artifact identities are retained",
        "programme failure remains a registry record"
      ],
      "implementation_state": "partial_contract",
      "next_design_transaction": "Emit an in-toto or equivalent source-to-GDS-to-measurement succession chain and reconstruct it from an isolated audit bundle.",
      "open_invariants": [
        "signed transformation chain",
        "artifact-only reconstruction after tool and facility removal"
      ],
      "pylon_id": "provenance-succession-chain"
    },
    {
      "control_question": "Can two substrate implementations preserve descriptor, lifecycle, state, fallback, and receipt behavior behind one binding?",
      "current_surface_refs": [
        "repo://src/ahead_rev_sim/physical_descriptor.py",
        "repo://src/ahead_rev_sim/physical_runtime.py",
        "repo://src/ahead_rev_sim/mmio_abi.py",
        "repo://src/ahead_rev_sim/provider_hitch.py"
      ],
      "implemented_invariants": [
        "physical-compute-mmio/v1 is the portable floor",
        "descriptor and capability surfaces are typed",
        "software fallback is mandatory",
        "Xphys cannot change evidence or acceptance"
      ],
      "implementation_state": "contract_implemented",
      "next_design_transaction": "Replace the loopback reference with an RC or thermal physical cartridge while preserving the exact host transaction.",
      "open_invariants": [
        "measured physical cartridge substitution"
      ],
      "pylon_id": "self-describing-cartridge"
    },
    {
      "control_question": "Does every physical candidate retain a public reference twin under identical accepted work?",
      "current_surface_refs": [
        "repo://src/ahead_rev_sim/physical_cartridges.py",
        "repo://src/ahead_rev_sim/physical_assay.py",
        "repo://src/ahead_rev_sim/provider_hitch.py"
      ],
      "implemented_invariants": [
        "reference RC and thermal cartridges execute through the shared runtime",
        "physical assay compares raw and transformed trajectories",
        "provider hitches require software fallback"
      ],
      "implementation_state": "contract_implemented",
      "next_design_transaction": "Run one measured physical cartridge and its software twin under the same accepted workload and emit first model-to-device divergence.",
      "open_invariants": [
        "live measured twin comparison"
      ],
      "pylon_id": "reference-twin-substitution"
    },
    {
      "control_question": "Are command, busy, reset, refusal, fault, receipt, and accepted-output states mutually explicit across implementations?",
      "current_surface_refs": [
        "repo://src/ahead_rev_sim/mmio_abi.py",
        "repo://src/ahead_rev_sim/physical_runtime.py",
        "repo://src/ahead_rev_sim/riscv_target.py",
        "repo://tests/test_mmio_abi.py"
      ],
      "implemented_invariants": [
        "complete reset, load, evolve, read, and capture surface",
        "ambiguous commands refuse",
        "done, refused, and fault outcomes are exclusive",
        "reset and receipt behavior are tested"
      ],
      "implementation_state": "contract_implemented",
      "next_design_transaction": "Execute the same lifecycle in Chipyard RTL and the first physical cartridge, including timeout and resolver fault paths.",
      "open_invariants": [
        "RTL lifecycle execution",
        "physical timeout and fault containment"
      ],
      "pylon_id": "lifecycle-refusal-state-machine"
    },
    {
      "control_question": "Are state, entropy, environment, calibration, clocks, power, and accepted output aligned to the same causal interval?",
      "current_surface_refs": [
        "repo://src/ahead_rev_sim/physical_signal.py",
        "repo://src/ahead_rev_sim/physical_receipt.py",
        "repo://src/ahead_rev_sim/evp.py"
      ],
      "implemented_invariants": [
        "exact, trace-replay, and distributional determinism are separate",
        "entropy traces and environment digests are first-class",
        "EVP binds calibration, environment, instruments, and time"
      ],
      "implementation_state": "partial_contract",
      "next_design_transaction": "Join instrument clocks, physical entropy, environment, calibration, power, and accepted output in one measured execution trace.",
      "open_invariants": [
        "measured multi-clock synchronization",
        "physical entropy custody"
      ],
      "pylon_id": "causal-custody-braid"
    },
    {
      "control_question": "Can accepted semantics survive portable representation, target lowering, and execution across two backends?",
      "current_surface_refs": [
        "repo://src/ahead_rev_sim/semantics.py",
        "repo://src/ahead_rev_sim/frontier.py",
        "repo://src/ahead_rev_sim/fambs_svk_lowering.py",
        "repo://src/ahead_rev_sim/fambs_pck_lowering.py",
        "repo://src/ahead_rev_sim/chipyard_integration.py"
      ],
      "implemented_invariants": [
        "instruction information effects precede lowering",
        "structured and memory-irregular semantic lowerings exist",
        "target artifacts remain bound to accepted output"
      ],
      "implementation_state": "partial_contract",
      "next_design_transaction": "Lower one composite FAMBS workload through CIRCT or Calyx and Chipyard, then prove source, IR, RTL, and target parity.",
      "open_invariants": [
        "composite workload lowering",
        "independent hardware-IR backend parity",
        "executed Chipyard RTL"
      ],
      "pylon_id": "semantic-ir-lowering-sandwich"
    },
    {
      "control_question": "Which measured behavior replaces each model tier, and where does the first fidelity divergence occur?",
      "current_surface_refs": [
        "repo://src/ahead_rev_sim/physical_assay.py",
        "repo://src/ahead_rev_sim/physical_receipt.py",
        "repo://src/ahead_rev_sim/evp.py",
        "repo://docs/physical_compute_substrates.md"
      ],
      "implemented_invariants": [
        "reference, simulated, and measured evidence classes are distinct",
        "model-only execution cannot make physical claims",
        "held-out assay retains source and response separation"
      ],
      "implementation_state": "partial_contract",
      "next_design_transaction": "Execute an ideal, nonideal, calibrated, and measured RC or stochastic-device staircase with first-divergence receipts.",
      "open_invariants": [
        "calibrated target-observed tier",